Sheet: Planilha1
A1: ID_registro | B1: Nome | C1: CPF | D1: Item | E1: Quantidade
A2: 1 | B2: João Guilherme Moura | C2: =RANDBETWEEN(10000000000, 99999999999) -> 75585365062 | D2: Groselha | E2: =RANDBETWEEN(1, 10) -> 2
A3: 2 | B3: Samuel Moreira | C3: =RANDBETWEEN(10000000000, 99999999999) -> 85743718081 | D3: Ovos | E3: =RANDBETWEEN(1, 10) -> 2
A4: 3 | B4: Juan da Paz | C4: =RANDBETWEEN(10000000000, 99999999999) -> 96100206118 | D4: Carne | E4: =RANDBETWEEN(1, 10) -> 5
A5: 4 | B5: Maria Eduarda Aragão | C5: =RANDBETWEEN(10000000000, 99999999999) -> 27279663407 | D5: Lentilhas | E5: =RANDBETWEEN(1, 10) -> 5
A6: 5 | B6: Pedro Farias | C6: =RANDBETWEEN(10000000000, 99999999999) -> 43478811695 | D6: Comida | E6: =RANDBETWEEN(1, 10) -> 7
A7: 6 | B7: Rafael Alves | C7: =RANDBETWEEN(10000000000, 99999999999) -> 85900145521 | D7: Batatas | E7: =RANDBETWEEN(1, 10) -> 10
A8: 7 | B8: Eloah Silva | C8: =RANDBETWEEN(10000000000, 99999999999) -> 51431018747 | D8: Morango | E8: =RANDBETWEEN(1, 10) -> 4
A9: 8 | B9: Camila Fogaça | C9: =RANDBETWEEN(10000000000, 99999999999) -> 32654851194 | D9: Ovos | E9: =RANDBETWEEN(1, 10) -> 9
A10: 9 | B10: Helena Cardoso | C10: =RANDBETWEEN(10000000000, 99999999999) -> 21919113347 | D10: Caqui | E10: =RANDBETWEEN(1, 10) -> 3
A11: 10 | B11: Dr. Luiz Fernando Ramos | C11: =RANDBETWEEN(10000000000, 99999999999) -> 38996284271 | D11: Figo | E11: =RANDBETWEEN(1, 10) -> 5
A12: 11 | B12: Ana Sophia Castro | C12: =RANDBETWEEN(10000000000, 99999999999) -> 36607131394 | D12: Carne de frango | E12: =RANDBETWEEN(1, 10) -> 4
A13: 12 | B13: Paulo Santos | C13: =RANDBETWEEN(10000000000, 99999999999) -> 62089087641 | D13: Vegetais | E13: =RANDBETWEEN(1, 10) -> 9